{
  "relationshipValidationId": "88000000-0000-4000-8000-000000000001",
  "relationshipKind": "scoped-key-reference",
  "left": {
    "sourceId": "11111111-1111-4111-8111-111111111111",
    "sourceVersion": "sha256:68fc3e599c5dcb5523a2d65c2d9586bfbec34d8b0dae0660659cf8b965533b13",
    "authorizationScopeId": "authorized-assets",
    "revocationEpoch": 0,
    "assetId": "work-records",
    "paths": ["ScopeId", "RecordId"]
  },
  "right": {
    "sourceId": "11111111-1111-4111-8111-111111111111",
    "sourceVersion": "sha256:68fc3e599c5dcb5523a2d65c2d9586bfbec34d8b0dae0660659cf8b965533b13",
    "authorizationScopeId": "authorized-partner-assets",
    "revocationEpoch": 0,
    "assetId": "partner-events",
    "paths": ["ScopeId", "RecordId"]
  },
  "crossScope": true,
  "crossScopeAuthorizationReceipt": {
    "receiptId": "88000000-0000-4000-8000-000000000002",
    "relationshipValidationId": "88000000-0000-4000-8000-000000000001",
    "actorSubjectHash": "7960befad07fdd60ae0edea6f19a4f629f5e714526db35421602c9ffcfb10b4e",
    "delegationChainHash": null,
    "left": {
      "sourceId": "11111111-1111-4111-8111-111111111111",
      "sourceVersion": "sha256:68fc3e599c5dcb5523a2d65c2d9586bfbec34d8b0dae0660659cf8b965533b13",
      "authorizationScopeId": "authorized-assets",
      "revocationEpoch": 0
    },
    "right": {
      "sourceId": "11111111-1111-4111-8111-111111111111",
      "sourceVersion": "sha256:68fc3e599c5dcb5523a2d65c2d9586bfbec34d8b0dae0660659cf8b965533b13",
      "authorizationScopeId": "authorized-partner-assets",
      "revocationEpoch": 0
    },
    "policyHash": "bbbbbbbbbbbbbbbbbbbbbbbbbbbbbbbbbbbbbbbbbbbbbbbbbbbbbbbbbbbbbbbb",
    "allowedOperation": "validate-relationship",
    "issuedAt": "2026-01-01T00:03:00Z",
    "expiresAt": "2026-01-01T01:00:00Z",
    "issuerKeyId": "conformance-cross-scope-v1",
    "signatureAlgorithm": "ed25519",
    "signature": "46XKXgzUMMdTe+ZYMYKYgQLsjc1ig8ZwDmg+hlnJTDmUOG4zUTewYNYQpXX04MHpSnIhBq5LmoQVma3CluZOAA=="
  },
  "predicates": [
    { "leftPath": "ScopeId", "rightPath": "ScopeId", "operator": "equals" },
    { "leftPath": "RecordId", "rightPath": "RecordId", "operator": "equals" }
  ],
  "normalization": [
    { "predicateIndex": 0, "family": "exact", "leftExpression": "ScopeId", "rightExpression": "ScopeId" },
    { "predicateIndex": 1, "family": "exact", "leftExpression": "RecordId", "rightExpression": "RecordId" }
  ],
  "validator": {
    "method": "composite-direct-probe",
    "methodVersion": "1.0.0",
    "basis": "empirical",
    "exact": true,
    "planHash": "1818181818181818181818181818181818181818181818181818181818181818",
    "authoritativeConstraintRef": null
  },
  "sampleReceipt": {
    "method": "one-side-exact-probe",
    "requestedUnits": 100,
    "populationEstimate": 100,
    "unitsInspected": 100,
    "exact": true,
    "seed": null,
    "bucketRule": null,
    "errorBound": 0,
    "strata": [],
    "excludedStrata": [],
    "failedStrata": []
  },
  "validationOutcome": "supported",
  "cardinality": { "leftDistinct": 100, "rightDistinct": 100, "relationshipType": "one-to-one" },
  "coverage": { "matchingKeys": 100, "leftCoverage": 1, "rightCoverage": 1, "confidenceBound": 1 },
  "recommendedOperation": "inner",
  "confidence": 1,
  "warnings": [],
  "createdAt": "2026-01-01T00:04:00Z"
}
